$ winpty mysql -u root -p
Enter password: ***********
Welcome to the MySQL monitor.  Commands end with ; or \g.
Your MySQL connection id is 15
Server version: 8.0.28 MySQL Community Server - GPL

Copyright (c) 2000, 2022, Oracle and/or its affiliates.

Oracle is a registered trademark of Oracle Corporation and/or its
affiliates. Other names may be trademarks of their respective
owners.

Type 'help;' or '\h' for help. Type '\c' to clear the current input statement.

mysql> show databases;
+------------------------+
| Database               |
+------------------------+
| emp                    |
| employeepayroll        |
| employeepayrollservice |
| information_schema     |
| mysql                  |
| performance_schema     |
| sample1                |
| sys                    |
| test                   |
+------------------------+
9 rows in set (0.00 sec)

mysql> use employeepayrollservice
Database changed
mysql> create table employee_payroll(ID int not null auto_increment, Name varchar(30) not null, Salary double not null, Start Date not null, primary key(id));
Query OK, 0 rows affected (2.01 sec)

mysql> desc employee_payroll;
+--------+-------------+------+-----+---------+----------------+
| Field  | Type        | Null | Key | Default | Extra          |
+--------+-------------+------+-----+---------+----------------+
| ID     | int         | NO   | PRI | NULL    | auto_increment |
| Name   | varchar(30) | NO   |     | NULL    |                |
| Salary | double      | NO   |     | NULL    |                |
| Start  | date        | NO   |     | NULL    |                |
+--------+-------------+------+-----+---------+----------------+
4 rows in set (0.07 sec)

mysql> insert into employee_payroll(Name, Salary,Start) values ('Nikita', 5000000.00, '2020-08-02'), ('amu', 20000000.00, '2021-04-12'),('arati', 42500000.00, '2020-12-12');
Query OK, 3 rows affected (0.21 sec)
Records: 3  Duplicates: 0  Warnings: 0

mysql> select * from employee_payroll;
+----+--------+----------+------------+
| ID | Name   | Salary   | Start      |
+----+--------+----------+------------+
|  1 | Nikita |  5000000 | 2020-08-02 |
|  2 | amu    | 20000000 | 2021-04-12 |
|  3 | arati  | 42500000 | 2020-12-12 |
+----+--------+----------+------------+
3 rows in set (0.00 sec)

mysql> select salary from employee_payroll where name = 'Nikita';
+---------+
| salary  |
+---------+
| 5000000 |
+---------+
1 row in set (0.02 sec)

mysql> select salary from employee_payroll where Start between cast('2021-01-01'
 as date) and date (now());
+----------+
| salary   |
+----------+
| 20000000 |
+----------+
1 row in set (0.04 sec)

mysql> alter table employee_payroll add gender char(1) after Name;
Query OK, 0 rows affected (3.82 sec)
Records: 0  Duplicates: 0  Warnings: 0

mysql> desc employee_payroll;
+--------+-------------+------+-----+---------+----------------+
| Field  | Type        | Null | Key | Default | Extra          |
+--------+-------------+------+-----+---------+----------------+
| ID     | int         | NO   | PRI | NULL    | auto_increment |
| Name   | varchar(30) | NO   |     | NULL    |                |
| gender | char(1)     | YES  |     | NULL    |                |
| Salary | double      | NO   |     | NULL    |                |
| Start  | date        | NO   |     | NULL    |                |
+--------+-------------+------+-----+---------+----------------+
5 rows in set (0.23 sec)

mysql> select * from employee_payroll;
+----+--------+--------+----------+------------+
| ID | Name   | gender | Salary   | Start      |
+----+--------+--------+----------+------------+
|  1 | Nikita | NULL   |  5000000 | 2020-08-02 |
|  2 | amu    | NULL   | 20000000 | 2021-04-12 |
|  3 | arati  | NULL   | 42500000 | 2020-12-12 |
+----+--------+--------+----------+------------+
3 rows in set (0.00 sec)

mysql> update employee_payroll set gender = 'M' where id = 1;
Query OK, 1 row affected (0.18 sec)
Rows matched: 1  Changed: 1  Warnings: 0

mysql> select * from employee_payroll;
+----+--------+--------+----------+------------+
| ID | Name   | gender | Salary   | Start      |
+----+--------+--------+----------+------------+
|  1 | Nikita | M      |  5000000 | 2020-08-02 |
|  2 | amu    | NULL   | 20000000 | 2021-04-12 |
|  3 | arati  | NULL   | 42500000 | 2020-12-12 |
+----+--------+--------+----------+------------+
3 rows in set (0.00 sec)

mysql> update employee_payroll set gender = 'M' where id = 3;
Query OK, 1 row affected (0.10 sec)
Rows matched: 1  Changed: 1  Warnings: 0

mysql> select * from employee_payroll;
+----+--------+--------+----------+------------+
| ID | Name   | gender | Salary   | Start      |
+----+--------+--------+----------+------------+
|  1 | Nikita | M      |  5000000 | 2020-08-02 |
|  2 | amu    | NULL   | 20000000 | 2021-04-12 |
|  3 | arati  | M      | 42500000 | 2020-12-12 |
+----+--------+--------+----------+------------+
3 rows in set (0.00 sec)

mysql> select sum(Salary) from employee_payroll;
+-------------+
| sum(Salary) |
+-------------+
|    67500000 |
+-------------+
1 row in set (0.22 sec)

mysql> select sum(Salary) as SUM_OF_SALARY from employee_payroll;
+---------------+
| SUM_OF_SALARY |
+---------------+
|      67500000 |
+---------------+
1 row in set (0.00 sec)

mysql> select avg(Salary) as AVGRAGE_OF_SALARY form employee_payroll;
ERROR 1064 (42000): You have an error in your SQL syntax; check the manual that
corresponds to your MySQL server version for the right syntax to use near 'form
employee_payroll' at line 1
mysql> select avg(Salary) form employee_payroll;
ERROR 1064 (42000): You have an error in your SQL syntax; check the manual that
corresponds to your MySQL server version for the right syntax to use near 'emplo
yee_payroll' at line 1
mysql> select avg(Salary) as AVERAGE_OF_SALARY from employee_payroll;
+-------------------+
| AVERAGE_OF_SALARY |
+-------------------+
|          22500000 |
+-------------------+
1 row in set (0.00 sec)

mysql> select max(Salary) as MAXIMUM_OF_SALARY from employee_payroll;
+-------------------+
| MAXIMUM_OF_SALARY |
+-------------------+
|          42500000 |
+-------------------+
1 row in set (0.12 sec)

mysql> select count(Salary) as COUNT_OF_SALARY from employee_payroll;
+-----------------+
| COUNT_OF_SALARY |
+-----------------+
|               3 |
+-----------------+
1 row in set (0.15 sec)

mysql> alter table employee_payroll add phone_no int (10) after Start;
Query OK, 0 rows affected, 1 warning (3.32 sec)
Records: 0  Duplicates: 0  Warnings: 1

mysql> select * from employee_payroll;
+----+--------+--------+----------+------------+----------+
| ID | Name   | gender | Salary   | Start      | phone_no |
+----+--------+--------+----------+------------+----------+
|  1 | Nikita | M      |  5000000 | 2020-08-02 |     NULL |
|  2 | amu    | F      | 20000000 | 2021-04-12 |     NULL |
|  3 | arati  | M      | 42500000 | 2020-12-12 |     NULL |
+----+--------+--------+----------+------------+----------+
3 rows in set (0.00 sec)

mysql> alter table employee_payroll add address varchar(255) after phone_no;
Query OK, 0 rows affected (0.95 sec)
Records: 0  Duplicates: 0  Warnings: 0

mysql> alter table employee_payroll add department varchar(25) after address;
Query OK, 0 rows affected (0.46 sec)
Records: 0  Duplicates: 0  Warnings: 0

mysql> select * from employee_payroll;
+----+--------+--------+----------+------------+----------+---------+-----------
-+
| ID | Name   | gender | Salary   | Start      | phone_no | address | department
 |
+----+--------+--------+----------+------------+----------+---------+-----------
-+
|  1 | Nikita | M      |  5000000 | 2020-08-02 |     NULL | NULL    | NULL
 |
|  2 | amu    | F      | 20000000 | 2021-04-12 |     NULL | NULL    | NULL
 |
|  3 | arati  | M      | 42500000 | 2020-12-12 |     NULL | NULL    | NULL
 |
+----+--------+--------+----------+------------+----------+---------+-----------
-+
3 rows in set (0.06 sec)

mysql> update employee_payroll set department = "cse" where ID = 1;
Query OK, 1 row affected (0.20 sec)
Rows matched: 1  Changed: 1  Warnings: 0

mysql> update employee_payroll set department = "mech" where ID = 2;
Query OK, 1 row affected (0.17 sec)
Rows matched: 1  Changed: 1  Warnings: 0

mysql> update employee_payroll set department = "ETC" where ID = 3;
Query OK, 1 row affected (0.17 sec)
Rows matched: 1  Changed: 1  Warnings: 0

mysql> select * from employee_payroll;
+----+--------+--------+----------+------------+----------+---------+------------+
| ID | Name   | gender | Salary   | Start      | phone_no | address | department |
+----+--------+--------+----------+------------+----------+---------+------------+
|  1 | Nikita | M      |  5000000 | 2020-08-02 |     NULL | NULL    | cse        |
|  2 | amu    | F      | 20000000 | 2021-04-12 |     NULL | NULL    | mech       |
|  3 | arati  | M      | 42500000 | 2020-12-12 |     NULL | NULL    | ETC        |
+----+--------+--------+----------+------------+----------+---------+------------+
3 rows in set (0.00 sec)

mysql> update employee_payroll set address = default;
Query OK, 0 rows affected (0.00 sec)
Rows matched: 3  Changed: 0  Warnings: 0

mysql> select * from employee_payroll;
+----+--------+--------+----------+------------+----------+---------+------------+
| ID | Name   | gender | Salary   | Start      | phone_no | address | department |
+----+--------+--------+----------+------------+----------+---------+------------+
|  1 | Nikita | M      |  5000000 | 2020-08-02 |     NULL | NULL    | cse        |
|  2 | amu    | F      | 20000000 | 2021-04-12 |     NULL | NULL    | mech       |
|  3 | arati  | M      | 42500000 | 2020-12-12 |     NULL | NULL    | ETC        |
+----+--------+--------+----------+------------+----------+---------+------------+
3 rows in set (0.00 sec)

mysql> update employee_payroll set Basic_pay = 400000 where name = amu;
ERROR 1054 (42S22): Unknown column 'amu' in 'where clause'
mysql> update employee_payroll set Basic_pay = 400000 where name = "amu";
Query OK, 1 row affected (0.11 sec)
Rows matched: 1  Changed: 1  Warnings: 0

mysql> update employee_payroll set Basic_pay = 500000 where name = "Nikita";
Query OK, 1 row affected (0.18 sec)
Rows matched: 1  Changed: 1  Warnings: 0

mysql> update employee_payroll set Basic_pay = 100000 where name = "arati";
Query OK, 1 row affected (0.85 sec)
Rows matched: 1  Changed: 1  Warnings: 0

mysql> alter table employee_payroll add Deduction int(5) after Basic_pay;
Query OK, 0 rows affected, 1 warning (2.12 sec)
Records: 0  Duplicates: 0  Warnings: 1

mysql> alter table employee_payroll add Taxable_pay int(5) after Deduction;
Query OK, 0 rows affected, 1 warning (0.76 sec)
Records: 0  Duplicates: 0  Warnings: 1

mysql> alter table employee_payroll add Income_pay int(5) after Taxable_pay;
Query OK, 0 rows affected, 1 warning (1.72 sec)
Records: 0  Duplicates: 0  Warnings: 1

mysql> alter table employee_payroll add Net_pay int(5) after Income_pay;
Query OK, 0 rows affected, 1 warning (1.60 sec)
Records: 0  Duplicates: 0  Warnings: 1

mysql> select * from employee_payroll;
+----+--------+--------+----------+------------+-----------+---------+------------+-----------+-----------+-------------+------------+---------+
| ID | Name   | gender | Salary   | Start      | phone_no  | address | department | Basic_pay | Deduction | Taxable_pay | Income_pay | Net_pay |
+----+--------+--------+----------+------------+-----------+---------+------------+-----------+-----------+-------------+------------+---------+
|  1 | Nikita | M      |  5000000 | 2020-08-02 | 987548645 | NULL    | cse        |    500000 |      NULL |        NULL |       NULL |    NULL |
|  2 | amu    | F      | 20000000 | 2021-04-12 | 987845715 | NULL    | mech       |    400000 |      NULL |        NULL |       NULL |    NULL |
|  3 | arati  | M      | 42500000 | 2020-12-12 |  98568795 | NULL    | ETC        |    100000 |      NULL |        NULL |       NULL |    NULL |
+----+--------+--------+----------+------------+-----------+---------+------------+-----------+-----------+-------------+------------+---------+
3 rows in set (0.00 sec)

mysql> alter table employee_payroll add Deduction double not null after Basic_pay;
Query OK, 0 rows affected (0.38 sec)
Records: 0  Duplicates: 0  Warnings: 0

mysql> alter table employee_payroll add Taxable_pay double not null after Deduction;
Query OK, 0 rows affected (0.60 sec)
Records: 0  Duplicates: 0  Warnings: 0

mysql> alter table employee_payroll add Income_pay double not null after Taxable_pay;
Query OK, 0 rows affected (0.57 sec)
Records: 0  Duplicates: 0  Warnings: 0

mysql> alter table employee_payroll add Net_pay double not null after Income_pay;
Query OK, 0 rows affected (0.61 sec)
Records: 0  Duplicates: 0  Warnings: 0

mysql> select * from employee_payroll;
+----+--------+--------+----------+------------+-----------+---------+------------+-----------+-----------+-------------+------------+---------+
| ID | Name   | gender | Salary   | Start      | phone_no  | address | department | Basic_pay | Deduction | Taxable_pay | Income_pay | Net_pay |
+----+--------+--------+----------+------------+-----------+---------+------------+-----------+-----------+-------------+------------+---------+
|  1 | Nikita | M      |  5000000 | 2020-08-02 | 987548645 | NULL    | cse        |    500000 |         0 |           0 |          0 |       0 |
|  2 | amu    | F      | 20000000 | 2021-04-12 | 987845715 | NULL    | mech       |    400000 |         0 |           0 |          0 |       0 |
|  3 | arati  | M      | 42500000 | 2020-12-12 |  98568795 | NULL    | ETC        |    100000 |         0 |           0 |          0 |       0 |
+----+--------+--------+----------+------------+-----------+---------+------------+-----------+-----------+-------------+------------+---------+
3 rows in set (0.00 sec)

mysql> insert into employee_payroll (Name,gender,Salary,Start,phone_no,address,department,Basic_pay,Deduction,Taxable_pay,Income_pay,Net_pay) values('Nik
ita','M',5000000,'2020-08-02',98754865,'abc','marketing',500000,20000,10000,3000,210000);
Query OK, 1 row affected (0.28 sec)

mysql> select * from employee_payroll;
+----+--------+--------+----------+------------+-----------+---------+------------+-----------+-----------+-------------+------------+---------+
| ID | Name   | gender | Salary   | Start      | phone_no  | address | department | Basic_pay | Deduction | Taxable_pay | Income_pay | Net_pay |
+----+--------+--------+----------+------------+-----------+---------+------------+-----------+-----------+-------------+------------+---------+
|  1 | Nikita | M      |  5000000 | 2020-08-02 | 987548645 | NULL    | sales      |    500000 |         0 |           0 |          0 |       0 |
|  2 | amu    | F      | 20000000 | 2021-04-12 | 987845715 | NULL    | mech       |    400000 |         0 |           0 |          0 |       0 |
|  3 | arati  | M      | 42500000 | 2020-12-12 |  98568795 | NULL    | ETC        |    100000 |         0 |           0 |          0 |       0 |
|  4 | Nikita | M      |  5000000 | 2020-08-02 |  98754865 | abc     | marketing  |    500000 |     20000 |       10000 |       3000 |  210000 |
+----+--------+--------+----------+------------+-----------+---------+------------+-----------+-----------+-------------+------------+---------+
4 rows in set (0.17 sec)

mysql> select * from employee_payroll where name = "Nikita";
+----+--------+--------+---------+------------+-----------+---------+------------+-----------+-----------+-------------+------------+---------+
| ID | Name   | gender | Salary  | Start      | phone_no  | address | department | Basic_pay | Deduction | Taxable_pay | Income_pay | Net_pay |
+----+--------+--------+---------+------------+-----------+---------+------------+-----------+-----------+-------------+------------+---------+
|  1 | Nikita | M      | 5000000 | 2020-08-02 | 987548645 | NULL    | sales      |    500000 |         0 |           0 |          0 |       0 |
|  4 | Nikita | M      | 5000000 | 2020-08-02 |  98754865 | abc     | marketing  |    500000 |     20000 |       10000 |       3000 |  210000 |
+----+--------+--------+---------+------------+-----------+---------+------------+-----------+-----------+-------------+------------+---------+
2 rows in set (0.06 sec)

mysql> CREATE TABLE Department ( department varchar(250) NOT NULL, PRIMARY KEY (department) );
Query OK, 0 rows affected (0.13 sec)


mysql> INSERT INTO employee_department ( department ) VALUES ('Sales'),('Marketing');
Query OK, 2 rows affected (0.01 sec)
Records: 2  Duplicates: 0  Warnings: 0

mysql> SELECT * FROM Department;
+------------+
| department |
+------------+
| Marketing  |
| Sales      |
+------------+
2 rows in set (0.00 sec)

mysql> CREATE TABLE Employee ( id int, compID int, PhoneNumbe BIGINT(13), Address varchar(25), gender char(1),
	PRIMARY KEY (id) );
Query OK, 0 rows affected, 1 warning (0.04 sec)

mysql> INSERT INTO Employee (id, compID, PhoneNumbe, Address, gender) VALUES ( 1, 10, 7775827779, 'Mubai', 'F'),
	(2, 11, 7775828889, 'Mumbai', 'M');
Query OK, 2 rows affected (0.05 sec)
Records: 2  Duplicates: 0  Warnings: 0

mysql> SELECT * FROM Employee;
+----+--------+------------+---------+--------+
| id | compID | PhoneNumbe | Address | gender |
+----+--------+------------+---------+--------+
|  1 |     10 | 7775827779 | Mubai   | F      |
|  2 |     11 | 7775828889 | Mumbai  | M      |
+----+--------+------------+---------+--------+
2 rows in set (0.00 sec)


mysql> CREATE TABLE Emp_Department (empID int, Depart varchar(250) NOT NULL, FOREIGN KEY (empID) REFERENCES Employee (id),
	FOREIGN KEY (Depart) REFERENCES Department (department), PRIMARY KEY (empID, Depart));
Query OK, 0 rows affected (0.04 sec)

mysql> describe Emp_Department;
+--------+--------------+------+-----+---------+-------+
| Field  | Type         | Null | Key | Default | Extra |
+--------+--------------+------+-----+---------+-------+
| empID  | int          | NO   | PRI | NULL    |       |
| Depart | varchar(250) | NO   | PRI | NULL    |       |
+--------+--------------+------+-----+---------+-------+
2 rows in set (0.02 sec)

mysql> INSERT INTO Emp_Department (empID, Depart) VALUES (1, 'Marketing');
Query OK, 1 row affected (0.02 sec)

mysql> INSERT INTO Emp_Department (empID, Depart) VALUES (1, 'Sales');
Query OK, 1 row affected (0.01 sec)

mysql> INSERT INTO Emp_Department (empID, Depart) VALUES (2, 'Sales');
Query OK, 1 row affected (0.01 sec)

mysql> INSERT INTO Emp_Department (empID, Depart) VALUES (2, 'Marketing');
Query OK, 1 row affected (0.04 sec)

mysql> SELECT * FROM Emp_Department;
+-------+-----------+
| empID | Depart    |
+-------+-----------+
|     1 | Marketing |
|     2 | Marketing |
|     1 | Sales     |
|     2 | Sales     |
+-------+-----------+
4 rows in set (0.00 sec)

mysql> SELECT * FROM Emp_Department WHERE empID = 1;
+-------+-----------+
| empID | Depart    |
+-------+-----------+
|     1 | Marketing |
|     1 | Sales     |
+-------+-----------+
2 rows in set (0.00 sec)

mysql> SELECT * FROM employee_department WHERE department = 1;
Empty set, 2 warnings (0.00 sec)

mysql> SELECT * FROM Department WHERE department = 'sales';
+------------+
| department |
+------------+
| Sales      |
+------------+
1 row in set (0.00 sec)